{
  "algorithms": {
    "analysis": {
      "hash": "d4425a54325fc4ceacce8b4e6c6ffe8569ef95f89eb35cc339ce0d546808b0c3",
      "ref": "ael-cep/analysis/anchor-utility/v1"
    },
    "eligibility": {
      "hash": "f50f8885c4eb8e5a6f4ccf77aca86c61037b80fe7510a2f345f57acef2fcb627",
      "ref": "ael-cep/eligibility/v1"
    },
    "promotion": {
      "hash": "2925e7c481019de4d196cd2a383e72ca56da0d56141ca490948fc8f2ec58a8a7",
      "ref": "ael-cep/promotion/fail-closed/v1"
    },
    "proposal_admission": {
      "hash": "34d408b03398a4d45c845d46e530728d090acf3b50df2d2673be4f260937a04b",
      "ref": "ael-cep/proposal-admission/fixed/v1"
    },
    "selection_ranking": {
      "hash": "db7def7c64a5deb1a3df10bd0a0f37274074a3f4c0efb133ac6a3328ac507e75",
      "ref": "ael-cep/selection-ranking/fixed/v1"
    },
    "stopping": {
      "hash": "c3ddfd7faa9c11e00f1b22bb22660a33413ea236ebc4dd054623a12b152c0246",
      "ref": "ael-cep/stopping/fixed-n/v1"
    },
    "task_allocation": {
      "hash": "1bd0ca675d34b483d7fed3d53a23d3a9efe1f147257e159b5c97cbe7b0041f22",
      "ref": "ael-cep/task-allocation/fixed-paired/v1"
    }
  },
  "arms": {
    "A0": {
      "anchor": "absent",
      "builder": "fixed",
      "challenger": "absent",
      "custody": "shared",
      "evaluator": "fixed",
      "loop": "open"
    },
    "A1": {
      "anchor": "absent",
      "builder": "evolving",
      "challenger": "absent",
      "custody": "shared",
      "evaluator": "fixed",
      "loop": "open"
    },
    "A2": {
      "anchor": "absent",
      "builder": "fixed",
      "challenger": "absent",
      "custody": "shared",
      "evaluator": "evolving",
      "loop": "open"
    },
    "A3": {
      "anchor": "absent",
      "builder": "evolving",
      "challenger": "absent",
      "custody": "shared",
      "evaluator": "evolving",
      "loop": "naive_closed"
    },
    "A4": {
      "anchor": "protected",
      "builder": "evolving",
      "challenger": "absent",
      "custody": "separated",
      "evaluator": "evolving",
      "loop": "custody_separated"
    },
    "A5": {
      "anchor": "protected",
      "builder": "evolving",
      "challenger": "present",
      "custody": "separated",
      "evaluator": "evolving",
      "loop": "challenger_anchor"
    }
  },
  "bridge": {
    "anchor_required": true,
    "construct_required": true,
    "decision_agreement_min": 0.9,
    "global_shift_tolerance": 0.05,
    "interaction_tolerance": 0.05,
    "reliability_required": true,
    "strata": [
      {
        "stratum": "good",
        "task_root_hash": "804656752f2c62dbb801845f25fe906dfdbed29643f9c467da64be0378a99b26",
        "weight": 0.2
      },
      {
        "stratum": "bad",
        "task_root_hash": "baf3e0416eee350eb2ef9c859dc3e9073284fd6eaf95b66e5bd09590bba1ea40",
        "weight": 0.2
      },
      {
        "stratum": "exploit",
        "task_root_hash": "f8c32d1970c9e075ebbfd911cb4415c5a4ad5d6cc1310bf75ed06757cd2fc250",
        "weight": 0.2
      },
      {
        "stratum": "semantic_mutant",
        "task_root_hash": "1327aef94faab4e5d5e8267647e52cfed35a0a1ee15dd11b4b794a37b9712fcb",
        "weight": 0.2
      },
      {
        "stratum": "near_threshold",
        "task_root_hash": "b6826eda6aa037b43bd50f8c3962b3f9095eb808e21249503f2f8e049d4f0d5c",
        "weight": 0.2
      }
    ]
  },
  "budgets": {
    "confirmation": 80.0,
    "exposure": 40.0,
    "feedback": 120.0,
    "total_system": 1000.0
  },
  "contrasts": [
    {
      "analysis": {
        "hash": "d4425a54325fc4ceacce8b4e6c6ffe8569ef95f89eb35cc339ce0d546808b0c3",
        "ref": "ael-cep/analysis/anchor-utility/v1"
      },
      "arm_a": "A0",
      "arm_b": "A1",
      "budgets": {
        "confirmation": 80.0,
        "exposure": 40.0,
        "feedback": 120.0,
        "total_system": 1000.0
      },
      "contrast_id": "contrast:A0:A1",
      "eligibility": {
        "hash": "f50f8885c4eb8e5a6f4ccf77aca86c61037b80fe7510a2f345f57acef2fcb627",
        "ref": "ael-cep/eligibility/v1"
      },
      "estimand_kind": "component",
      "promotion": {
        "hash": "2925e7c481019de4d196cd2a383e72ca56da0d56141ca490948fc8f2ec58a8a7",
        "ref": "ael-cep/promotion/fail-closed/v1"
      },
      "proposal_admission": {
        "hash": "34d408b03398a4d45c845d46e530728d090acf3b50df2d2673be4f260937a04b",
        "ref": "ael-cep/proposal-admission/fixed/v1"
      },
      "selection_ranking": {
        "hash": "db7def7c64a5deb1a3df10bd0a0f37274074a3f4c0efb133ac6a3328ac507e75",
        "ref": "ael-cep/selection-ranking/fixed/v1"
      },
      "stopping": {
        "hash": "c3ddfd7faa9c11e00f1b22bb22660a33413ea236ebc4dd054623a12b152c0246",
        "ref": "ael-cep/stopping/fixed-n/v1"
      },
      "task_allocation": {
        "hash": "1bd0ca675d34b483d7fed3d53a23d3a9efe1f147257e159b5c97cbe7b0041f22",
        "ref": "ael-cep/task-allocation/fixed-paired/v1"
      },
      "treatment": {
        "arm_a_level": "fixed",
        "arm_b_level": "evolving",
        "dimension": "builder"
      }
    },
    {
      "analysis": {
        "hash": "d4425a54325fc4ceacce8b4e6c6ffe8569ef95f89eb35cc339ce0d546808b0c3",
        "ref": "ael-cep/analysis/anchor-utility/v1"
      },
      "arm_a": "A0",
      "arm_b": "A2",
      "budgets": {
        "confirmation": 80.0,
        "exposure": 40.0,
        "feedback": 120.0,
        "total_system": 1000.0
      },
      "contrast_id": "contrast:A0:A2",
      "eligibility": {
        "hash": "f50f8885c4eb8e5a6f4ccf77aca86c61037b80fe7510a2f345f57acef2fcb627",
        "ref": "ael-cep/eligibility/v1"
      },
      "estimand_kind": "component",
      "promotion": {
        "hash": "2925e7c481019de4d196cd2a383e72ca56da0d56141ca490948fc8f2ec58a8a7",
        "ref": "ael-cep/promotion/fail-closed/v1"
      },
      "proposal_admission": {
        "hash": "34d408b03398a4d45c845d46e530728d090acf3b50df2d2673be4f260937a04b",
        "ref": "ael-cep/proposal-admission/fixed/v1"
      },
      "selection_ranking": {
        "hash": "db7def7c64a5deb1a3df10bd0a0f37274074a3f4c0efb133ac6a3328ac507e75",
        "ref": "ael-cep/selection-ranking/fixed/v1"
      },
      "stopping": {
        "hash": "c3ddfd7faa9c11e00f1b22bb22660a33413ea236ebc4dd054623a12b152c0246",
        "ref": "ael-cep/stopping/fixed-n/v1"
      },
      "task_allocation": {
        "hash": "1bd0ca675d34b483d7fed3d53a23d3a9efe1f147257e159b5c97cbe7b0041f22",
        "ref": "ael-cep/task-allocation/fixed-paired/v1"
      },
      "treatment": {
        "arm_a_level": "fixed",
        "arm_b_level": "evolving",
        "dimension": "evaluator"
      }
    },
    {
      "analysis": {
        "hash": "d4425a54325fc4ceacce8b4e6c6ffe8569ef95f89eb35cc339ce0d546808b0c3",
        "ref": "ael-cep/analysis/anchor-utility/v1"
      },
      "arm_a": "A0",
      "arm_b": "A3",
      "budgets": {
        "confirmation": 80.0,
        "exposure": 40.0,
        "feedback": 120.0,
        "total_system": 1000.0
      },
      "contrast_id": "contrast:A0:A3",
      "eligibility": {
        "hash": "f50f8885c4eb8e5a6f4ccf77aca86c61037b80fe7510a2f345f57acef2fcb627",
        "ref": "ael-cep/eligibility/v1"
      },
      "estimand_kind": "policy_package",
      "promotion": {
        "hash": "2925e7c481019de4d196cd2a383e72ca56da0d56141ca490948fc8f2ec58a8a7",
        "ref": "ael-cep/promotion/fail-closed/v1"
      },
      "proposal_admission": {
        "hash": "34d408b03398a4d45c845d46e530728d090acf3b50df2d2673be4f260937a04b",
        "ref": "ael-cep/proposal-admission/fixed/v1"
      },
      "selection_ranking": {
        "hash": "db7def7c64a5deb1a3df10bd0a0f37274074a3f4c0efb133ac6a3328ac507e75",
        "ref": "ael-cep/selection-ranking/fixed/v1"
      },
      "stopping": {
        "hash": "c3ddfd7faa9c11e00f1b22bb22660a33413ea236ebc4dd054623a12b152c0246",
        "ref": "ael-cep/stopping/fixed-n/v1"
      },
      "task_allocation": {
        "hash": "1bd0ca675d34b483d7fed3d53a23d3a9efe1f147257e159b5c97cbe7b0041f22",
        "ref": "ael-cep/task-allocation/fixed-paired/v1"
      },
      "treatment": {
        "arm_a_level": "A0",
        "arm_b_level": "A3",
        "dimension": "policy_package"
      }
    },
    {
      "analysis": {
        "hash": "d4425a54325fc4ceacce8b4e6c6ffe8569ef95f89eb35cc339ce0d546808b0c3",
        "ref": "ael-cep/analysis/anchor-utility/v1"
      },
      "arm_a": "A0",
      "arm_b": "A4",
      "budgets": {
        "confirmation": 80.0,
        "exposure": 40.0,
        "feedback": 120.0,
        "total_system": 1000.0
      },
      "contrast_id": "contrast:A0:A4",
      "eligibility": {
        "hash": "f50f8885c4eb8e5a6f4ccf77aca86c61037b80fe7510a2f345f57acef2fcb627",
        "ref": "ael-cep/eligibility/v1"
      },
      "estimand_kind": "policy_package",
      "promotion": {
        "hash": "2925e7c481019de4d196cd2a383e72ca56da0d56141ca490948fc8f2ec58a8a7",
        "ref": "ael-cep/promotion/fail-closed/v1"
      },
      "proposal_admission": {
        "hash": "34d408b03398a4d45c845d46e530728d090acf3b50df2d2673be4f260937a04b",
        "ref": "ael-cep/proposal-admission/fixed/v1"
      },
      "selection_ranking": {
        "hash": "db7def7c64a5deb1a3df10bd0a0f37274074a3f4c0efb133ac6a3328ac507e75",
        "ref": "ael-cep/selection-ranking/fixed/v1"
      },
      "stopping": {
        "hash": "c3ddfd7faa9c11e00f1b22bb22660a33413ea236ebc4dd054623a12b152c0246",
        "ref": "ael-cep/stopping/fixed-n/v1"
      },
      "task_allocation": {
        "hash": "1bd0ca675d34b483d7fed3d53a23d3a9efe1f147257e159b5c97cbe7b0041f22",
        "ref": "ael-cep/task-allocation/fixed-paired/v1"
      },
      "treatment": {
        "arm_a_level": "A0",
        "arm_b_level": "A4",
        "dimension": "policy_package"
      }
    },
    {
      "analysis": {
        "hash": "d4425a54325fc4ceacce8b4e6c6ffe8569ef95f89eb35cc339ce0d546808b0c3",
        "ref": "ael-cep/analysis/anchor-utility/v1"
      },
      "arm_a": "A0",
      "arm_b": "A5",